{
  "dppId": "urn:example:dpp:000001",
  "schemaVersion": "1.0.0",
  "recordVersion": 1,
  "status": "active",
  "createdAt": "2042-02-11T08:00:00Z",
  "updatedAt": "2042-02-13T10:30:00Z",
  "responsibleOperatorId": "urn:example:org:manufacturer-a",
  "identity": {
    "granularity": "item",
    "itemId": "urn:example:item:000001",
    "epc": "urn:example:carrier:000001",
    "sampleId": "SYNTH-0001"
  },
  "product": {
    "articleClass": "homeTextileFlat",
    "fabricConstruction": "woven",
    "colourPrimary": "light",
    "technicalFlags": []
  },
  "materialObservations": [
    {
      "observationId": "urn:example:observation:000001-cotton",
      "fibreType": "cotton",
      "percentage": 62,
      "percentageBasis": "declaredLabel",
      "valueStatus": "supplied",
      "method": "supplierDeclaration",
      "sourceOrganisationId": "urn:example:org:manufacturer-a",
      "observedAt": "2042-02-12T09:00:00Z"
    },
    {
      "observationId": "urn:example:observation:000001-flax",
      "fibreType": "flax",
      "percentage": 38,
      "percentageBasis": "declaredLabel",
      "valueStatus": "supplied",
      "method": "supplierDeclaration",
      "sourceOrganisationId": "urn:example:org:manufacturer-a",
      "observedAt": "2042-02-12T09:00:00Z"
    }
  ]
}
